{
  "version": 21,
  "edges": [
    {
      "id": "/maplibre-basemap.maplibre->/deck-renderer.basemap",
      "source": "/maplibre-basemap",
      "target": "/deck-renderer",
      "sourceHandle": "out.maplibre",
      "targetHandle": "par.basemap"
    },
    {
      "id": "/test-layer.layer->/deck-renderer.maplibreLayers",
      "source": "/test-layer",
      "target": "/deck-renderer",
      "sourceHandle": "out.layer",
      "targetHandle": "par.maplibreLayers"
    },
    {
      "id": "/deck-renderer.vis->/out.vis",
      "source": "/deck-renderer",
      "target": "/out",
      "sourceHandle": "out.vis",
      "targetHandle": "par.vis"
    }
  ],
  "editorSettings": {
    "layoutMode": "noodles-on-top",
    "showOverlay": true
  },
  "nodes": [
    {
      "id": "/maplibre-basemap",
      "type": "MaplibreBasemapOp",
      "position": {
        "x": 100,
        "y": 100
      },
      "data": {
        "inputs": {
          "mapStyle": "https://basemaps.cartocdn.com/gl/dark-matter-gl-style/style.json",
          "projection": "mercator",
          "viewState": {
            "latitude": 40.7128,
            "longitude": -74.006,
            "zoom": 13,
            "pitch": 45,
            "bearing": 0
          }
        }
      }
    },
    {
      "id": "/test-layer",
      "type": "CustomMapLibreLayerOp",
      "position": {
        "x": 100,
        "y": 300
      },
      "data": {
        "inputs": {
          "id": "test-custom-layer",
          "renderingMode": "3d",
          "code": "{\n  onAdd: function(map, gl) {\n    console.log('Custom layer added:', params);\n    this.map = map;\n    this.gl = gl;\n  },\n  render: function(gl, matrix) {\n    // Simple render - just log once\n    if (!this.hasLogged) {\n      console.log('Custom layer rendering');\n      this.hasLogged = true;\n    }\n  },\n  onRemove: function(map, gl) {\n    console.log('Custom layer removed');\n  }\n}",
          "params": {
            "color": "#ff0000",
            "opacity": 0.5
          }
        }
      }
    },
    {
      "id": "/deck-renderer",
      "type": "DeckRendererOp",
      "position": {
        "x": 400,
        "y": 200
      },
      "data": {
        "inputs": {
          "layers": [],
          "views": []
        }
      }
    },
    {
      "id": "/out",
      "type": "OutOp",
      "position": {
        "x": 700,
        "y": 200
      },
      "data": {
        "inputs": {
          "display": "fixed",
          "width": 1920,
          "height": 1080,
          "lod": 2,
          "waitForData": true,
          "codec": "avc",
          "bitrateMbps": 10,
          "bitrateMode": "constant",
          "scaleControl": 0.3,
          "framerate": 30,
          "captureDelay": 50
        }
      }
    }
  ],
  "timeline": {
    "sheetsById": {
      "Noodles": {
        "staticOverrides": {
          "byObject": {}
        }
      }
    }
  }
}
